{
  "meta": {
    "script": "POS",
    "question": "Who is already inside the trade? Speculative COT positioning (LF/MM) vs structural (AM), per G8 currency and metals.",
    "pine_version": "v1_2_6",
    "py_version": "0.1.0",
    "generated_at": "2026-10-17T12:54:27+00:00",
    "run_id": "39034358806",
    "commit": "89b933367337",
    "schema_version": "1.0",
    "twin_test": {
      "status": "PASSED",
      "started": "2026-08-25",
      "weeks_elapsed": 7.6,
      "state_discrepancy_pct": 6.67,
      "acta": null,
      "per_key": {
        "AUD": 16.67,
        "CAD": 0.0,
        "CHF": 16.67,
        "EUR": 16.67,
        "GBP": 16.67,
        "JPY": 0.0,
        "NZD": 0.0,
        "USD": 0.0,
        "XAG": 0.0,
        "XAU": 0.0
      },
      "bars_compared": 60,
      "dates_compared": 6,
      "py_warmup_na_pct": 0.0,
      "compared_from": "2026-08-25",
      "compared_to": "2026-09-29"
    },
    "funnel_eligible": true
  },
  "inputs": [
    {
      "feed_id": "CFTC_TFF",
      "ccy": "GLOBAL",
      "metric": "tff",
      "value": 9.0,
      "data_date": "2026-10-13",
      "age_bd": 3,
      "quality": "LIVE",
      "source_used": "PRIMARY",
      "calendar": "US",
      "plausibility": "OK"
    }
  ],
  "outputs": {
    "regime": {
      "label": "CROWDED",
      "since": "2026-10-13",
      "changed_this_run": false
    },
    "per_ccy": {
      "EUR": {
        "score": -2.53,
        "state": "CROWD SHORT",
        "percentile": 0.6,
        "z": -2.53,
        "window_bars": 156,
        "thresholds_frozen": {
          "warn": 1.51,
          "ext": 2.26,
          "z_cap": 3.0
        },
        "components": {
          "lf_net": -68001.0,
          "lf_cot_index": 0.0,
          "lf_pct_oi": -7.8,
          "d_print": -23740.0,
          "d_4w": -39845.0,
          "d_13w": -14310.0,
          "am_net": 199918.0,
          "am_z": -1.32,
          "am_state_shadow": "NEUTRAL",
          "time_in_state": 1,
          "divergence": false
        },
        "na_reason": null
      },
      "GBP": {
        "score": -1.33,
        "state": "NEUTRAL",
        "percentile": 9.6,
        "z": -1.33,
        "window_bars": 156,
        "thresholds_frozen": {
          "warn": 1.47,
          "ext": 2.06,
          "z_cap": 3.0
        },
        "components": {
          "lf_net": 10313.0,
          "lf_cot_index": 23.5,
          "lf_pct_oi": 3.8,
          "d_print": -2119.0,
          "d_4w": -8565.0,
          "d_13w": -18228.0,
          "am_net": -145735.0,
          "am_z": -2.0,
          "am_state_shadow": "NEUTRAL",
          "time_in_state": 2,
          "divergence": false
        },
        "na_reason": null
      },
      "JPY": {
        "score": 0.31,
        "state": "NEUTRAL",
        "percentile": 66.0,
        "z": 0.31,
        "window_bars": 156,
        "thresholds_frozen": {
          "warn": 1.44,
          "ext": 2.42,
          "z_cap": 3.0
        },
        "components": {
          "lf_net": -33673.0,
          "lf_cot_index": 53.1,
          "lf_pct_oi": -9.0,
          "d_print": -8630.0,
          "d_4w": -56843.0,
          "d_13w": 56788.0,
          "am_net": 65819.0,
          "am_z": 0.96,
          "am_state_shadow": "NEUTRAL",
          "time_in_state": 3,
          "divergence": false
        },
        "na_reason": null
      },
      "AUD": {
        "score": 1.52,
        "state": "STRETCH+",
        "percentile": 89.1,
        "z": 1.52,
        "window_bars": 156,
        "thresholds_frozen": {
          "warn": 1.46,
          "ext": 2.3,
          "z_cap": 3.0
        },
        "components": {
          "lf_net": 50591.0,
          "lf_cot_index": 82.8,
          "lf_pct_oi": 14.9,
          "d_print": -3542.0,
          "d_4w": -10544.0,
          "d_13w": 23369.0,
          "am_net": -115920.0,
          "am_z": -2.1,
          "am_state_shadow": "STRETCH-",
          "time_in_state": 10,
          "divergence": true
        },
        "na_reason": null
      },
      "NZD": {
        "score": -0.6,
        "state": "NEUTRAL",
        "percentile": 27.6,
        "z": -0.6,
        "window_bars": 156,
        "thresholds_frozen": {
          "warn": 1.56,
          "ext": 2.26,
          "z_cap": 3.0
        },
        "components": {
          "lf_net": -11619.0,
          "lf_cot_index": 42.3,
          "lf_pct_oi": -9.3,
          "d_print": -10832.0,
          "d_4w": -9853.0,
          "d_13w": 17383.0,
          "am_net": -44139.0,
          "am_z": -1.13,
          "am_state_shadow": "NEUTRAL",
          "time_in_state": 6,
          "divergence": false
        },
        "na_reason": null
      },
      "CAD": {
        "score": -1.48,
        "state": "NEUTRAL",
        "percentile": 10.3,
        "z": -1.48,
        "window_bars": 156,
        "thresholds_frozen": {
          "warn": 1.51,
          "ext": 2.36,
          "z_cap": 3.0
        },
        "components": {
          "lf_net": -88112.0,
          "lf_cot_index": 16.6,
          "lf_pct_oi": -23.3,
          "d_print": -8487.0,
          "d_4w": -49090.0,
          "d_13w": 4659.0,
          "am_net": -30804.0,
          "am_z": 0.61,
          "am_state_shadow": "NEUTRAL",
          "time_in_state": 9,
          "divergence": true
        },
        "na_reason": null
      },
      "CHF": {
        "score": -1.43,
        "state": "NEUTRAL",
        "percentile": 11.5,
        "z": -1.43,
        "window_bars": 156,
        "thresholds_frozen": {
          "warn": 1.47,
          "ext": 2.02,
          "z_cap": 3.0
        },
        "components": {
          "lf_net": -14941.0,
          "lf_cot_index": 29.1,
          "lf_pct_oi": -10.9,
          "d_print": -3591.0,
          "d_4w": 23.0,
          "d_13w": -5441.0,
          "am_net": -31456.0,
          "am_z": -0.05,
          "am_state_shadow": "NEUTRAL",
          "time_in_state": 3,
          "divergence": false
        },
        "na_reason": null
      },
      "USD": {
        "score": 0.79,
        "state": "STRETCH+",
        "percentile": null,
        "z": 0.79,
        "window_bars": 156,
        "thresholds_frozen": {
          "warn": 0.79,
          "ext": 1.15,
          "z_cap": 3.0
        },
        "components": {
          "lf_net": 155442.0,
          "proxy": true,
          "note": "desk proxy: -mean(7 LF Z) \u00b7 AM: -mean(7 AM Z)",
          "am_z": 0.72,
          "am_state_shadow": "NEUTRAL"
        },
        "na_reason": null
      },
      "XAU": {
        "score": -0.67,
        "state": "NEUTRAL",
        "percentile": 26.9,
        "z": -0.67,
        "window_bars": 156,
        "thresholds_frozen": {
          "warn": 1.68,
          "ext": 2.29,
          "z_cap": 3.0
        },
        "components": {
          "mm_net": 107089.0,
          "mm_cot_index": 39.4,
          "mm_pct_oi": 27.0,
          "d_print": -3898.0,
          "d_4w": -26027.0,
          "d_13w": -13690.0,
          "time_in_state": 106
        },
        "na_reason": null
      },
      "XAG": {
        "score": -1.4,
        "state": "NEUTRAL",
        "percentile": 2.9,
        "z": -1.4,
        "window_bars": 104,
        "thresholds_frozen": {
          "warn": 1.61,
          "ext": 2.25,
          "z_cap": 3.0
        },
        "components": {
          "mm_net": 5619.0,
          "mm_cot_index": 2.3,
          "mm_pct_oi": 5.2,
          "d_print": -1909.0,
          "d_4w": -7505.0,
          "d_13w": -5882.0,
          "time_in_state": 25
        },
        "na_reason": null
      }
    },
    "pairs": {}
  },
  "dqm": {
    "health_score": 100.0,
    "n_inputs": 1,
    "n_live": 1,
    "n_proxy": 0,
    "n_manual": 0,
    "n_stale": 0,
    "n_dead": 0,
    "n_manual_expired": 0,
    "alerts": []
  },
  "gate_m": {
    "is_oos": true,
    "cutoff_date": "2026-06-19",
    "signal_snapshot": {
      "EUR": {
        "state": "CROWD SHORT",
        "score": -2.53
      },
      "GBP": {
        "state": "NEUTRAL",
        "score": -1.33
      },
      "JPY": {
        "state": "NEUTRAL",
        "score": 0.31
      },
      "AUD": {
        "state": "STRETCH+",
        "score": 1.52
      },
      "NZD": {
        "state": "NEUTRAL",
        "score": -0.6
      },
      "CAD": {
        "state": "NEUTRAL",
        "score": -1.48
      },
      "CHF": {
        "state": "NEUTRAL",
        "score": -1.43
      },
      "USD": {
        "state": "STRETCH+",
        "score": 0.79
      },
      "XAU": {
        "state": "NEUTRAL",
        "score": -0.67
      },
      "XAG": {
        "state": "NEUTRAL",
        "score": -1.4
      }
    },
    "forward_windows_bd": [
      5,
      10,
      20
    ],
    "realised": null
  },
  "journal_link": {
    "state_hash": "e4f3d3f01cf33048becfcf168d101ae669dda9a25bb19a534a394cf45e0808e4",
    "prev_state_hash": "e4f3d3f01cf33048becfcf168d101ae669dda9a25bb19a534a394cf45e0808e4",
    "diff_vs_prev": []
  }
}